{
  "overview": "Custom agents are now in public preview for JetBrains IDEs, Eclipse, and Xcode, allowing you to package reusable expertise, guardrails, and tool access into AI agents tailored to your project or organization.",
  "detailed_explanation": [
    {
      "title": "Overview",
      "bullets": [
        "Custom agents are now in public preview for JetBrains IDEs, Eclipse, and Xcode, allowing you to package reusable expertise, guardrails, and tool access into AI agents tailored to your project or organization."
      ]
    },
    {
      "title": "What’s new",
      "bullets": [
        "Custom agents bring customization to your chat mode by letting you specify name, description, tools, and models. Create specialized AI agents tailored to your workflows and coding standards in JetBrains, Eclipse, and Xcode. Define agents using Markdown files that specify prompts, so you can pick them up and run in your IDEs quickly."
      ]
    },
    {
      "title": "Try it out",
      "bullets": [
        "Update your IDE : Install the latest Copilot extension for your JetBrains IDE, Eclipse, or Xcode to access the custom agents preview.",
        "Create a custom agent : Follow the custom agents quickstart and how-to guide to generate a starter configuration file describing the agent’s name, description, instructions, knowledge sources, and tool policies.",
        "Pick the custom agent : In Copilot Chat, select your custom agent from the list of available agents.",
        "Test the agent : Start the conversation under the current custom agent."
      ]
    },
    {
      "title": "Share your feedback",
      "bullets": [
        "Your feedback drives our roadmap. Let us know how custom agents are working for you by using the feedback controls in your IDE or through your existing Copilot support channels.",
        "In-product feedback : Use the feedback options within your IDE.",
        "GitHub discussions : Share your thoughts in the following channels: JetBrains GitHub Copilot in JetBrains feedback repository Eclipse GitHub Copilot in Eclipse feedback repository Xcode GitHub Copilot in Xcode feedback repository",
        "JetBrains GitHub Copilot in JetBrains feedback repository",
        "Eclipse GitHub Copilot in Eclipse feedback repository",
        "Xcode GitHub Copilot in Xcode feedback repository"
      ]
    }
  ],
  "key_changes": [],
  "impact": [
    "Custom agents are now in public preview for JetBrains IDEs, Eclipse, and Xcode, allowing you to package reusable expertise, guardrails, and tool access into AI agents tailored to your project or organization."
  ],
  "caveats": [],
  "insights": [],
  "confidence": 0.8500000000000001
}
